[
  {
    "surface_type": "playbook_federation_surface",
    "playbook_id": "AOA-P-0006",
    "name": "self-agent-checkpoint-rollout",
    "participating_agents": [
      "architect",
      "coder",
      "reviewer",
      "memory-keeper"
    ],
    "memory_posture": "bounded_recall",
    "required_skills": [
      "mode.knowledge.authority-map",
      "guard.operations.approval",
      "guard.operations.preview",
      "workflow.operations.repository-change"
    ],
    "memo_contract_refs": [
      "mechanics/checkpoint/parts/checkpoint-to-memory-mapping/examples/checkpoint_to_memory_contract.example.json",
      "examples/support-objects/provenance_thread.example.json"
    ],
    "memo_writeback_targets": [
      "decision",
      "audit_event",
      "provenance_thread"
    ],
    "eval_anchors": [
      "aoa-approval-boundary-adherence",
      "aoa-bounded-change-quality"
    ]
  },
  {
    "surface_type": "playbook_federation_surface",
    "playbook_id": "AOA-P-0007",
    "name": "witness-to-compost-pilot",
    "participating_agents": [
      "architect",
      "coder",
      "reviewer",
      "memory-keeper"
    ],
    "memory_posture": "deep_recall",
    "required_skills": [
      "mode.knowledge.authority-map",
      "workflow.operations.repository-change"
    ],
    "memo_contract_refs": [
      "examples/recall/recall_contract.router.semantic.json",
      "mechanics/checkpoint/parts/checkpoint-to-memory-mapping/examples/checkpoint_to_memory_contract.example.json",
      "examples/support-objects/provenance_thread.example.json"
    ],
    "memo_writeback_targets": [
      "episode",
      "decision",
      "audit_event",
      "provenance_thread"
    ],
    "eval_anchors": [
      "aoa-witness-trace-integrity",
      "aoa-compost-provenance-preservation"
    ]
  },
  {
    "surface_type": "playbook_federation_surface",
    "playbook_id": "AOA-P-0008",
    "name": "long-horizon-model-tier-orchestra",
    "participating_agents": [
      "architect",
      "coder",
      "reviewer",
      "memory-keeper"
    ],
    "memory_posture": "bounded_recall",
    "required_skills": [
      "workflow.operations.repository-change",
      "mode.knowledge.authority-map",
      "guard.operations.preview",
      "mode.engineering-shape.contexts"
    ],
    "memo_contract_refs": [
      "examples/recall/recall_contract.router.semantic.json",
      "mechanics/checkpoint/parts/checkpoint-to-memory-mapping/examples/checkpoint_to_memory_contract.example.json"
    ],
    "memo_writeback_targets": [
      "decision",
      "claim",
      "pattern"
    ],
    "eval_anchors": [
      "aoa-long-horizon-depth",
      "aoa-tool-trajectory-discipline"
    ],
    "memo_recall_modes": [
      "semantic",
      "procedural"
    ],
    "memo_scope_default": "workspace",
    "memo_scope_ceiling": "ecosystem",
    "memo_read_path": "inspect_capsule_then_expand",
    "memo_checkpoint_posture": "not_needed",
    "memo_source_route_policy": "required"
  },
  {
    "surface_type": "playbook_federation_surface",
    "playbook_id": "AOA-P-0009",
    "name": "restartable-inquiry-loop",
    "participating_agents": [
      "architect",
      "reviewer",
      "evaluator",
      "memory-keeper"
    ],
    "memory_posture": "deep_recall",
    "required_skills": [
      "mode.knowledge.authority-map",
      "workflow.operations.repository-change",
      "guard.operations.preview",
      "mode.engineering-shape.contexts"
    ],
    "memo_contract_refs": [
      "examples/recall/recall_contract.object.working.return.json",
      "mechanics/checkpoint/parts/checkpoint-to-memory-mapping/examples/checkpoint_to_memory_contract.example.json"
    ],
    "memo_writeback_targets": [
      "state_capsule",
      "decision"
    ],
    "eval_anchors": [
      "aoa-long-horizon-depth"
    ],
    "memo_recall_modes": [
      "working"
    ],
    "memo_scope_default": "project",
    "memo_scope_ceiling": "ecosystem",
    "memo_read_path": "inspect_then_expand",
    "memo_checkpoint_posture": "required",
    "memo_source_route_policy": "preferred"
  },
  {
    "surface_type": "playbook_federation_surface",
    "playbook_id": "AOA-P-0010",
    "name": "cross-repo-boundary-rollout",
    "participating_agents": [
      "architect",
      "coder",
      "reviewer",
      "evaluator",
      "memory-keeper"
    ],
    "memory_posture": "bounded_recall",
    "required_skills": [
      "mode.knowledge.authority-map",
      "mode.engineering-shape.contexts",
      "guard.operations.approval",
      "guard.operations.preview",
      "workflow.operations.repository-change"
    ],
    "memo_contract_refs": [
      "examples/recall/recall_contract.router.semantic.json",
      "mechanics/checkpoint/parts/checkpoint-to-memory-mapping/examples/checkpoint_to_memory_contract.example.json",
      "examples/support-objects/provenance_thread.example.json"
    ],
    "memo_writeback_targets": [
      "decision",
      "audit_event",
      "provenance_thread"
    ],
    "eval_anchors": [
      "aoa-approval-boundary-adherence",
      "aoa-scope-drift-detection"
    ],
    "memo_recall_modes": [
      "episodic",
      "semantic"
    ],
    "memo_scope_default": "workspace",
    "memo_scope_ceiling": "workspace",
    "memo_read_path": "inspect_capsule_then_expand",
    "memo_checkpoint_posture": "not_needed",
    "memo_source_route_policy": "required"
  },
  {
    "surface_type": "playbook_federation_surface",
    "playbook_id": "AOA-P-0011",
    "name": "bounded-change-safe",
    "participating_agents": [
      "architect",
      "coder",
      "reviewer",
      "memory-keeper"
    ],
    "memory_posture": "bounded_recall",
    "required_skills": [
      "guard.operations.approval",
      "mode.knowledge.authority-map",
      "mode.engineering-shape.contexts",
      "guard.operations.preview",
      "workflow.operations.repository-change",
      "mode.verification.contract",
      "workflow.operations.tdd-slice",
      "mode.decision.record",
      "mode.knowledge.sanitized-share"
    ],
    "memo_contract_refs": [
      "mechanics/checkpoint/parts/checkpoint-to-memory-mapping/examples/checkpoint_to_memory_contract.example.json",
      "examples/support-objects/provenance_thread.example.json"
    ],
    "memo_writeback_targets": [
      "decision",
      "audit_event",
      "provenance_thread"
    ],
    "eval_anchors": [
      "aoa-approval-boundary-adherence",
      "aoa-bounded-change-quality"
    ]
  },
  {
    "surface_type": "playbook_federation_surface",
    "playbook_id": "AOA-P-0012",
    "name": "infra-change-guarded",
    "participating_agents": [
      "architect",
      "coder",
      "reviewer",
      "memory-keeper"
    ],
    "memory_posture": "bounded_recall",
    "required_skills": [
      "guard.operations.approval",
      "mode.knowledge.authority-map",
      "guard.operations.preview",
      "workflow.operations.safe-infra-change",
      "workflow.operations.local-stack-bringup",
      "mode.verification.contract",
      "mode.decision.record",
      "mode.knowledge.sanitized-share"
    ],
    "memo_contract_refs": [
      "mechanics/checkpoint/parts/checkpoint-to-memory-mapping/examples/checkpoint_to_memory_contract.example.json",
      "examples/support-objects/provenance_thread.example.json"
    ],
    "memo_writeback_targets": [
      "decision",
      "audit_event",
      "provenance_thread"
    ],
    "eval_anchors": [
      "aoa-approval-boundary-adherence",
      "aoa-verification-honesty"
    ]
  },
  {
    "surface_type": "playbook_federation_surface",
    "playbook_id": "AOA-P-0013",
    "name": "invariants-first-refactor",
    "participating_agents": [
      "architect",
      "coder",
      "reviewer",
      "memory-keeper"
    ],
    "memory_posture": "bounded_recall",
    "required_skills": [
      "mode.engineering-shape.contexts",
      "mode.engineering-shape.core",
      "mode.verification.property",
      "workflow.operations.tdd-slice",
      "mode.engineering-shape.port-adapter",
      "mode.verification.coverage-audit",
      "mode.verification.contract",
      "mode.decision.record"
    ],
    "memo_contract_refs": [
      "mechanics/checkpoint/parts/checkpoint-to-memory-mapping/examples/checkpoint_to_memory_contract.example.json",
      "examples/support-objects/provenance_thread.example.json"
    ],
    "memo_writeback_targets": [
      "decision",
      "audit_event",
      "provenance_thread"
    ],
    "eval_anchors": [
      "aoa-scope-drift-detection",
      "aoa-verification-honesty"
    ]
  },
  {
    "surface_type": "playbook_federation_surface",
    "playbook_id": "AOA-P-0014",
    "name": "local-stack-diagnosis",
    "participating_agents": [
      "architect",
      "coder",
      "reviewer",
      "memory-keeper"
    ],
    "memory_posture": "bounded_recall",
    "required_skills": [
      "mode.knowledge.authority-map",
      "guard.operations.preview",
      "workflow.operations.local-stack-bringup",
      "workflow.operations.repository-change",
      "mode.verification.contract",
      "mode.knowledge.sanitized-share"
    ],
    "memo_contract_refs": [
      "mechanics/checkpoint/parts/checkpoint-to-memory-mapping/examples/checkpoint_to_memory_contract.example.json",
      "examples/support-objects/provenance_thread.example.json"
    ],
    "memo_writeback_targets": [
      "decision",
      "audit_event",
      "provenance_thread"
    ],
    "eval_anchors": [
      "aoa-verification-honesty",
      "aoa-tool-trajectory-discipline"
    ]
  },
  {
    "surface_type": "playbook_federation_surface",
    "playbook_id": "AOA-P-0015",
    "name": "source-truth-then-share",
    "participating_agents": [
      "architect",
      "coder",
      "reviewer",
      "memory-keeper"
    ],
    "memory_posture": "light_recall",
    "required_skills": [
      "mode.knowledge.authority-map",
      "mode.decision.record",
      "mode.knowledge.sanitized-share"
    ],
    "memo_contract_refs": [